{
  "$schema": "https://json-schema.org/draft/2020-12/schema",
  "$id": "https://raw.githubusercontent.com/signalk-espOS/registry/main/schema/project.schema.json",
  "title": "espOS firmware project",
  "description": "One firmware project that can be installed on an espOS device. Mirrors the RegistryProject type in signalk-espos-manager; CI validates every entry against this file.",
  "type": "object",
  "additionalProperties": false,
  "required": [
    "id",
    "app",
    "name",
    "repo",
    "targets"
  ],
  "properties": {
    "id": {
      "type": "string",
      "pattern": "^[a-z0-9][a-z0-9-]{1,38}$",
      "description": "Short identifier; must equal the filename without .json."
    },
    "app": {
      "type": "string",
      "minLength": 1,
      "maxLength": 32,
      "description": "The firmware's CMake project() name — what the device reports via mDNS and /api/v1/system/ping, and what espOS matches an update manifest against. NOT the repository name, and NOT espos_start_opts_t.app_name. Getting this wrong means devices never find their updates, with no hint why."
    },
    "name": {
      "type": "string",
      "minLength": 3,
      "maxLength": 60,
      "description": "Display name, e.g. \"P4 Cockpit\"."
    },
    "summary": {
      "type": "string",
      "maxLength": 140,
      "description": "One line describing what the firmware does."
    },
    "description": {
      "type": "string",
      "maxLength": 4000
    },
    "repo": {
      "type": "string",
      "pattern": "^[\\w.-]+/[\\w.-]+$",
      "description": "GitHub owner/repo. Releases are read from here."
    },
    "homepage": {
      "type": "string",
      "format": "uri"
    },
    "license": {
      "type": "string",
      "maxLength": 64
    },
    "targets": {
      "type": "array",
      "minItems": 1,
      "items": {
        "type": "string",
        "enum": [
          "esp32",
          "esp32c2",
          "esp32c3",
          "esp32c5",
          "esp32c6",
          "esp32c61",
          "esp32h2",
          "esp32p4",
          "esp32s2",
          "esp32s3"
        ]
      }
    },
    "boards": {
      "type": "array",
      "description": "Boards this firmware supports. Declare every one: espOS matches an update on chip alone, so when two incompatible boards share a target the flasher has to ask which the user has — the wrong image is usually a black screen. Each entry is the image's view of a board; what the board itself is (vendor, photo, features) lives in boards/<id>.json under the same id.",
      "items": {
        "type": "object",
        "additionalProperties": false,
        "required": [
          "id",
          "target"
        ],
        "properties": {
          "id": {
            "type": "string",
            "pattern": "^[a-z0-9][a-z0-9-]{1,48}$"
          },
          "target": {
            "type": "string"
          },
          "name": {
            "type": "string",
            "minLength": 3,
            "maxLength": 120,
            "description": "What the flasher shows. Optional when boards/<id>.json exists: the index fills it in from there."
          },
          "flashMinBytes": {
            "type": "integer",
            "minimum": 1048576,
            "description": "Smallest flash this firmware fits. A 16 MB partition table on a 4 MB module fails or half-works."
          },
          "notes": {
            "type": "string",
            "maxLength": 400
          },
          "buyUrl": {
            "type": "string",
            "format": "uri",
            "description": "Optional when boards/<id>.json exists, which is the better home for it."
          },
          "reportedAs": {
            "type": "string",
            "minLength": 1,
            "maxLength": 64,
            "description": "The board string this board's firmware reports verbatim in GET /api/v1/system/info -> hardware.board (espOS opts.board). Matched EXACTLY, never fuzzily: it is what decides whether an over-the-air update may be offered, and a near-miss would install firmware for a different display. Omit it when the firmware does not report a board; the update is then withheld rather than guessed."
          },
          "assetSegment": {
            "type": "string",
            "pattern": "^[a-z0-9]+$",
            "maxLength": 24,
            "description": "The segment this board's release assets carry, as captured by the `board` named group in assets.ota/assets.merged (e.g. \"7b\" in p4_cockpit-v1.3.0-7b-ota.bin). Compared case-insensitively. Without it a board-labelled asset cannot be tied to a board, and the build is not offered over the air."
          },
          "support": {
            "type": "string",
            "enum": [
              "tested",
              "community",
              "builds"
            ],
            "description": "How far this firmware is known to work on this board: \"tested\" by the project on the bench, \"community\" reported working by a user, \"builds\" only built for it. The index ranks a use case's boards by this first, then by downloads; leaving it out ranks between \"community\" and \"builds\"."
          },
          "runsOn": {
            "type": "array",
            "minItems": 1,
            "uniqueItems": true,
            "items": {
              "type": "string",
              "pattern": "^[a-z0-9][a-z0-9-]{1,48}$"
            },
            "description": "Catalogue boards (boards/<id>.json) this image runs on, when it is one image for several boards. Defaults to this entry's own id. Every board listed must use this entry's target."
          }
        }
      }
    },
    "channels": {
      "type": "array",
      "items": {
        "type": "string",
        "enum": [
          "stable",
          "beta"
        ]
      }
    },
    "assets": {
      "type": "object",
      "additionalProperties": false,
      "description": "Anchored regexes matching the release assets. A `version` named group is required; a `board` named group is needed when a release carries one image per board, and its value is matched against each board's assetSegment. Without a board group a release with several assets is not indexed at all, rather than one being picked arbitrarily.",
      "properties": {
        "ota": {
          "type": "string"
        },
        "merged": {
          "type": "string"
        }
      }
    },
    "signingKeyId": {
      "type": "string",
      "description": "Stable identity of the signing key these releases use: the first 16 hex characters of the key's Secure Boot V2 public-key digest (`espsecure signature-info-v2 <image>.bin`), which a device on an espOS release after 0.15.0 reports as running.key_fp. A device only accepts firmware signed with the key it was flashed with, so changing this strands every device already in the field.",
      "minLength": 16,
      "maxLength": 16,
      "pattern": "^[0-9a-f]{16}$"
    },
    "signed": {
      "type": "boolean",
      "default": true,
      "description": "False when releases are built with a throwaway key: those flash over USB but accept no updates afterwards."
    },
    "official": {
      "type": "boolean",
      "description": "Maintained by the signalk-espOS organisation. Set by maintainers only."
    },
    "deprecated": {
      "oneOf": [
        {
          "type": "boolean"
        },
        {
          "type": "string"
        }
      ],
      "description": "True, or a sentence saying what to use instead."
    },
    "screenshots": {
      "type": "array",
      "maxItems": 6,
      "items": {
        "type": "string",
        "format": "uri"
      }
    },
    "minEsposVersion": {
      "type": "string"
    },
    "webAssetsBranch": {
      "type": "string",
      "pattern": "^[A-Za-z0-9._/-]+$",
      "maxLength": 128,
      "description": "Branch of `repo` carrying the release images, laid out as <tag>/<asset>. GitHub serves release downloads without an Access-Control-Allow-Origin header, so a browser cannot fetch them; raw.githubusercontent does send one. Declare this and the index also publishes mergedWebUrl/otaWebUrl pointing there, which is what the web flasher uses. Without it a project's firmware can only be installed from the Signal K plugin, which fetches server-side and is unaffected."
    },
    "esposSubmodule": {
      "type": "string",
      "pattern": "^[A-Za-z0-9._/-]+$",
      "maxLength": 128,
      "description": "Path of the espOS submodule inside `repo`, when it is not the default \"espos\". The reindexer reads the pin at each release tag and records the espOS version that release was built against, so a consumer can say whether a build predates a runtime fix. An exact tag match only: a project pinned to an untagged commit records no version rather than a wrong one."
    }
  }
}
