{
  "id": "zigbee-coordinator",
  "app": "zigbee_coordinator",
  "name": "Zigbee Coordinator",
  "summary": "A Zigbee coordinator that Zigbee2MQTT reaches over Wi-Fi",
  "description": "Runs the Zigbee network on the chip's own 802.15.4 radio and serves it to Zigbee2MQTT over Wi-Fi, so the coordinator can sit where the devices are rather than in a USB port of the server. Set Zigbee2MQTT's adapter to zboss and its port to tcp://<device>:6638, or mdns://espos-zigbee. One Zigbee2MQTT at a time per coordinator. Over Wi-Fi it needs longer timeouts than the official Zigbee2MQTT image sets, and network backup and restore need patches too; the ghcr.io/tostmann/zigbee2mqtt-esp32 image carries both.\n\nIt decodes nothing itself: devices, their values and their Signal K paths are Zigbee2MQTT's. Only the ESP32-C5 and ESP32-C6 have the radio.",
  "repo": "dirkwa/espos-zigbee-coordinator",
  "license": "Apache-2.0",
  "signingKeyId": "2e645f2a10b6679a",
  "targets": [
    "esp32c5",
    "esp32c6"
  ],
  "boards": [
    {
      "id": "waveshare-esp32-c5-wifi6-kit",
      "target": "esp32c5",
      "assetSegment": "esp32c5",
      "flashMinBytes": 16777216,
      "notes": "Joins a 2.4 or 5 GHz Wi-Fi network; Zigbee itself is always on 2.4 GHz.",
      "support": "builds"
    },
    {
      "id": "esp32c6-devkit",
      "target": "esp32c6",
      "assetSegment": "esp32c6",
      "flashMinBytes": 8388608,
      "notes": "Needs 8 MB of flash; the 4 MB kits are too small.",
      "support": "builds"
    }
  ],
  "assets": {
    "ota": "^zigbee-coordinator-(?<board>esp32[a-z0-9]*)-v?(?<version>[0-9][^-]*)-ota\\.bin$",
    "merged": "^zigbee-coordinator-(?<board>esp32[a-z0-9]*)-v?(?<version>[0-9][^-]*)-merged\\.bin$"
  },
  "webAssetsBranch": "release-assets",
  "channels": [
    "stable"
  ],
  "official": true
}
